{
  "$schema": "https://json-schema.org/draft/2020-12/schema",
  "$id": "https://axeyum.dev/schema/claim.schema.json",
  "title": "Axeyum claim ledger record",
  "description": "One mathematical claim as a first-class artifact joining a topic citation (concepts, prerequisites, epistemic status) to machine-checked evidence (witnesses, certificates, checkers). Untrusted search proposes; recorded checkers dispose.\n\nADR-0553: `concept_refs` are CITATIONS. They name a graph and an id and nothing resolves them, here or anywhere. Until 2026-08-24 `graph` was an enum whose only value was `math-education`, `concept_refs` was required, `resolved` was required on every ref, and `provenance.graph_pin` carried that repository's 40-hex commit -- so no claim could be recorded in this repository without asserting a resolution against a sibling checkout at a pinned revision, and all 104 committed claims carried the same SHA. A claim must stand on its `formal` block and its `evidence`; the citation is gloss.",
  "type": "object",
  "additionalProperties": false,
  "required": [
    "schema_version",
    "id",
    "title",
    "statement",
    "epistemic_status",
    "formal",
    "concept_refs",
    "axeyum_refs",
    "provenance",
    "evidence"
  ],
  "properties": {
    "schema_version": {
      "type": "integer",
      "minimum": 1
    },
    "id": {
      "type": "string",
      "pattern": "^[a-z0-9][a-z0-9-]*$",
      "description": "Stable kebab-case identity; equals the containing directory name."
    },
    "title": {
      "type": "string",
      "minLength": 3
    },
    "statement": {
      "type": "string",
      "minLength": 10,
      "description": "The claim in one or two precise human sentences, including quantifier ranges. This is what the evidence is evidence FOR."
    },
    "epistemic_status": {
      "enum": [
        "axiom",
        "proved",
        "computed",
        "empirical",
        "conjectured",
        "open"
      ],
      "description": "axiom=assumed; proved=general-case proof; computed=established by calculation or exhaustive check over a stated range; empirical=observed; conjectured=believed, unproved; open=nobody knows. Shared verbatim with `fact.schema.json`'s `epistemic_status` (which adds `refuted`), so the two ledgers report one epistemics."
    },
    "novelty": {
      "enum": [
        "new",
        "reproduction",
        "replication"
      ],
      "description": "Whether the claimed value is new to the literature, a reproduction of a published one, or a replication of an unpublished computation. A machine-readable field because five claims once shipped labelled NEW in free-text notes for values published four months earlier: scripts/check-claim-certificates.py requires that a reproduction name prior art establishing the same value."
    },
    "formal": {
      "type": "object",
      "additionalProperties": false,
      "required": [
        "language",
        "family",
        "parameters"
      ],
      "properties": {
        "language": {
          "enum": [
            "cnf-family",
            "smtlib2",
            "axeyum-term",
            "prose-only"
          ],
          "description": "How the claim is mechanized. cnf-family: a parameterized generator emits the deciding CNF. prose-only claims cannot carry checked evidence."
        },
        "family": {
          "type": "string",
          "description": "Generator or theory family, e.g. 'rado-colouring-a(x-y)=bz'. One family = one semantics note + one generator."
        },
        "parameters": {
          "type": "object",
          "description": "Exact instantiation, e.g. {\"a\":2,\"b\":3,\"k\":4,\"n\":225}. The generator plus these parameters must reproduce the deciding instance bit-for-bit."
        },
        "generator": {
          "type": "string",
          "description": "Repo-relative path of the instance generator."
        },
        "semantics_note": {
          "type": "string",
          "description": "Repo-relative path documenting the encoding's faithfulness argument."
        }
      }
    },
    "concept_refs": {
      "type": "array",
      "description": "Unresolved topic citations. A `graph` label and a `ref` id; no path, no revision, and no resolution claim. `resolved` was removed by ADR-0553 along with `provenance.graph_pin`: with no pin, `resolved: true` was an assertion about an external artifact that nothing could check, which is worse than an honest citation.",
      "items": {
        "type": "object",
        "additionalProperties": false,
        "required": [
          "graph",
          "ref",
          "relation"
        ],
        "properties": {
          "graph": {
            "description": "A free-text label naming where the id comes from. Deliberately NOT an enum: a one-value enum made citing that one corpus mandatory, which is how a gloss field became a dependency.",
            "type": "string",
            "minLength": 1
          },
          "ref": {
            "type": "string",
            "pattern": "^(C|M|TQ|TH|TM)|^(C:[a-z0-9][a-z0-9./-]*@[a-z]+)$",
            "description": "A concept (C:slug), encounter (C:slug@level), misconception (M:slug), technique (TQ:slug), thread or theme id."
          },
          "relation": {
            "enum": [
              "instance-of",
              "exercises",
              "refutes",
              "frontier-of",
              "uses-technique"
            ],
            "description": "instance-of: the claim instantiates the concept. exercises: deciding it exercises the concept at that encounter depth. refutes: machine evidence against a misconception. frontier-of: the claim sits on the open frontier of the concept. uses-technique: the proof/search uses the technique."
          },
          "note": {
            "type": "string"
          }
        }
      }
    },
    "axeyum_refs": {
      "type": "object",
      "additionalProperties": false,
      "required": [
        "fragments"
      ],
      "properties": {
        "fragments": {
          "type": "array",
          "items": {
            "type": "string",
            "pattern": "^[a-z0-9_]+$"
          },
          "description": "smt-fragments.json row ids exercised by the deciding route, e.g. [\"qf_bv\"]; empty if decided outside axeyum."
        },
        "curriculum_nodes": {
          "type": "array",
          "items": {
            "type": "string"
          },
          "description": "docs/curriculum/curriculum.toml node ids."
        },
        "concept_ids": {
          "type": "array",
          "items": {
            "type": "string"
          },
          "description": "artifacts/ontology/foundational-concepts.json row ids."
        },
        "scenario_family": {
          "type": "string",
          "description": "axeyum_scenarios::Family variant realizing this claim as a self-checking exercise, when one exists."
        }
      }
    },
    "provenance": {
      "type": "object",
      "additionalProperties": false,
      "required": [
        "conjectured_by",
        "searched_by",
        "checked_by",
        "date"
      ],
      "properties": {
        "conjectured_by": {
          "type": "string",
          "description": "Who/what proposed the claim: 'literature: <citation>', 'llm: <model>', 'human: <name>', 'enumeration: <tool>'."
        },
        "searched_by": {
          "type": "array",
          "items": {
            "type": "string"
          },
          "description": "UNTRUSTED search tools with versions, e.g. 'kissat 4.0.4', 'lsearch (min-conflicts, seed 12345)'. Nothing here is in the trust base."
        },
        "checked_by": {
          "type": "array",
          "items": {
            "type": "string"
          },
          "description": "TRUSTED disposers with versions: independent verifiers, certificate checkers. Every definitive evidence row names at least one."
        },
        "date": {
          "type": "string",
          "pattern": "^\\d{4}-\\d{2}-\\d{2}$"
        },
        "machine": {
          "type": "string"
        },
        "toolchain": {
          "type": "object",
          "additionalProperties": false,
          "description": "Pinned identity of the software that produced regenerable evidence. REQUIRED whenever any evidence row carries a `regeneration` block: a recipe without a pinned toolchain is not reproducible, because a different build produces a different artifact and the recorded hash becomes unfalsifiable.",
          "required": [
            "axeyum_commit",
            "rustc_version"
          ],
          "properties": {
            "axeyum_commit": {
              "type": "string",
              "pattern": "^[0-9a-f]{40}$",
              "description": "40-hex commit of this repository at build time."
            },
            "rustc_version": {
              "type": "string"
            },
            "target": {
              "type": "string",
              "description": "Target triple or arch."
            },
            "dirty": {
              "type": "boolean",
              "description": "True if the working tree had uncommitted changes at build time. A dirty build cannot be reproduced from the commit alone, so a regenerable evidence row built dirty is recorded honestly rather than silently."
            }
          }
        },
        "prior_art": {
          "type": "array",
          "items": {
            "type": "object",
            "additionalProperties": false,
            "required": [
              "citation",
              "establishes"
            ],
            "properties": {
              "citation": {
                "type": "string"
              },
              "url": {
                "type": "string"
              },
              "establishes": {
                "type": "string",
                "description": "Exactly what the cited work establishes, so our delta is auditable."
              }
            }
          }
        }
      }
    },
    "evidence": {
      "type": "array",
      "description": "Machine-checked evidence rows. A claim with epistemic_status 'computed' must carry at least one row whose check_status is 'checked'. Rows are append-preferred; superseded rows keep history.",
      "items": {
        "type": "object",
        "additionalProperties": false,
        "required": [
          "id",
          "kind",
          "supports",
          "check_status",
          "checker_command"
        ],
        "properties": {
          "id": {
            "type": "string",
            "pattern": "^[a-z0-9][a-z0-9-]*$"
          },
          "kind": {
            "enum": [
              "witness-replay",
              "unsat-certificate",
              "cube-cover",
              "cube-tree-cover",
              "exhaustive-enumeration",
              "published-value-replication",
              "bound-citation",
              "instance-pin"
            ],
            "description": "witness-replay: a concrete object re-validated against the definition. unsat-certificate: DRAT/LRAT/Farkas artifact re-checked by an independent checker. cube-cover: a decomposed refutation — every cube of an exhaustive case split independently refuted and its proof checked; the artifact is the per-cube ledger and the checker re-verifies exhaustiveness against the formula's own case-split clauses. cube-tree-cover: the same, for an ADAPTIVE cover whose cubes sit at mixed depths because a cube that exhausted its budget was split further; the checker re-verifies that the cubes are exactly the leaf set of a complete branch trie (no hole, no cube inside another) rather than exactly a product. exhaustive-enumeration: full finite sweep. published-value-replication: our pipeline reproduces a cited value. bound-citation: a bound taken from literature, NOT machine-checked here."
          },
          "parameters": {
            "type": "object",
            "description": "Evidence-row-specific parameters the checker needs, e.g. {\"branch\": [2,4,6,8], \"cubes\": 256} for a cube-cover.",
            "additionalProperties": true
          },
          "supports": {
            "type": "string",
            "description": "The exact sub-statement this row supports, e.g. 'R_4 > 240 (lower bound)'."
          },
          "artifact": {
            "type": "string",
            "description": "Repo-relative path of the evidence artifact (colouring, DRAT file, log)."
          },
          "artifact_sha256": {
            "type": "string",
            "pattern": "^[0-9a-f]{64}$"
          },
          "regeneration": {
            "type": "object",
            "additionalProperties": false,
            "description": "For evidence too large to distribute: the exact command that reproduces the artifact and the SHA-256 of what it produces. Because checking a proof costs orders of magnitude more than regenerating it, a recipe plus a hash imposes almost no extra cost on a verifier while removing gigabytes from the record. Requires provenance.toolchain.",
            "required": [
              "command",
              "produces_sha256"
            ],
            "properties": {
              "command": {
                "type": "string",
                "description": "Exact, runnable command producing the artifact."
              },
              "produces_sha256": {
                "type": "string",
                "pattern": "^[0-9a-f]{64}$"
              },
              "bytes": {
                "type": "integer",
                "minimum": 0
              },
              "approx_wall_seconds": {
                "type": "number",
                "minimum": 0
              },
              "note": {
                "type": "string"
              }
            }
          },
          "check_status": {
            "enum": [
              "checked",
              "replay-only",
              "not-checked"
            ],
            "description": "checked: an independent checker validated the artifact and the run is recorded. replay-only: re-derived but not by an independent tool. not-checked: recorded, no machine validation (mandatory for bound-citation)."
          },
          "checker_command": {
            "type": "string",
            "description": "Exact reproduction command, or 'none' for bound-citation rows."
          },
          "notes": {
            "type": "string"
          },
          "artifact_format": {
            "type": "string",
            "enum": [
              "drat-text",
              "drat-text-gzip",
              "drat-binary",
              "drat-binary-gzip",
              "dimacs-cnf",
              "colouring-text",
              "tsv-ledger"
            ],
            "description": "Dialect of the stored artifact, read from its BYTES by the validator and never taken from this record's say-so (findings register B8)."
          },
          "distribution": {
            "type": "string",
            "enum": [
              "regenerable"
            ],
            "description": "Set by a bundle builder on rows whose artifact that bundle deliberately does not carry. The row must still record artifact_sha256, so what regeneration has to produce stays pinned. Never set in the ledger itself."
          }
        }
      }
    },
    "frontier": {
      "type": "object",
      "additionalProperties": false,
      "description": "Present iff epistemic_status is 'conjectured' or 'open': what is known and what would settle it. This is the field that makes open problems first-class instead of unrepresentable.",
      "required": [
        "known",
        "would_settle"
      ],
      "properties": {
        "known": {
          "type": "array",
          "items": {
            "type": "string"
          },
          "description": "Current best bounds/partial results with their evidence ids or citations."
        },
        "would_settle": {
          "type": "string",
          "description": "The concrete artifact that would settle the claim, e.g. 'an UNSAT certificate for F_n at any n, plus a verified colouring at n-1'."
        },
        "attack_notes": {
          "type": "string"
        }
      }
    },
    "supersedes": {
      "type": "string",
      "description": "Claim id this record supersedes (e.g. a strictly better bound)."
    },
    "notes": {
      "type": "string"
    }
  }
}
