{
  "schema_version": 1,
  "id": "rado-r3-a2-b5",
  "title": "R_3(2(x-y)=5z) = 181",
  "statement": "The 3-colour Rado number of the equation 2(x-y) = 5z is exactly 181: every 3-colouring of {1,...,181} contains a monochromatic solution, and some 3-colouring of {1,...,180} avoids one.",
  "epistemic_status": "computed",
  "formal": {
    "language": "cnf-family",
    "family": "rado-colouring-a(x-y)=bz",
    "parameters": {
      "a": 2,
      "b": 5,
      "k": 3,
      "n": 181
    },
    "generator": "scripts/gen-rado-instance.py",
    "semantics_note": "artifacts/claims/rado/SEMANTICS.md"
  },
  "concept_refs": [
    {
      "graph": "math-education",
      "ref": "C:rado-number",
      "relation": "instance-of",
      "note": "authored this session at math-education graph/concepts/rado-number.md (uncommitted)"
    },
    {
      "graph": "math-education",
      "ref": "C:ramsey-number",
      "relation": "exercises",
      "note": "Rado numbers are the arithmetic-Ramsey analogue: the same threshold/colouring reasoning at a different structure"
    },
    {
      "graph": "math-education",
      "ref": "C:pigeonhole-principle",
      "relation": "exercises"
    },
    {
      "graph": "math-education",
      "ref": "TQ:colouring",
      "relation": "uses-technique"
    },
    {
      "graph": "math-education",
      "ref": "C:computational-search",
      "relation": "exercises"
    }
  ],
  "axeyum_refs": {
    "fragments": [],
    "curriculum_nodes": [
      "propositional-logic"
    ]
  },
  "provenance": {
    "conjectured_by": "literature: Y. Chang, J. A. De Loera, W. J. Wesley, 'Rado Numbers and SAT Computations', ISSAC 2022 / arXiv:2210.03262",
    "searched_by": [
      "axeyum proof-producing CDCL core (solve_with_drat_proof_streaming, pure Rust, ADR-0381): produced the stored certificate in 0.006 s",
      "HISTORICAL (superseded, ADR-0002 oracle role only): kissat 4.0.4 (rel-4.0.4) produced the original binary-DRAT certificate for this instance on 2026-08-12"
    ],
    "checked_by": [
      "axeyum in-tree backward DRAT checker (check_drat_backward, ADR-0382, pure Rust): re-derived all 980 steps of the stored certificate in 0.007 s",
      "scripts/check-claim-certificates.py witness replay (independent O(n^2) enumerator)",
      "HISTORICAL (no longer in the trusted path): drat-trim (2026 build, references/drat-trim) verified the superseded kissat binary-DRAT certificate on 2026-08-12"
    ],
    "date": "2026-08-12",
    "machine": "linux x86-64, 4 cores",
    "prior_art": [
      {
        "citation": "Y. Chang, J. A. De Loera, W. J. Wesley, 'Rado Numbers and SAT Computations', ISSAC 2022 / arXiv:2210.03262",
        "url": "https://arxiv.org/abs/2210.03262",
        "establishes": "R_3(2(x-y)=5z) = 181 (Tables 1 and 10)"
      }
    ],
    "toolchain": {
      "axeyum_commit": "406be5fa8b28a14d803103a5e95147b3b5ae541d",
      "rustc_version": "rustc 1.99.0-nightly (be8e82435 2026-07-11)",
      "target": "x86_64-unknown-linux-gnu",
      "dirty": false
    }
  },
  "evidence": [
    {
      "id": "lower-witness",
      "kind": "witness-replay",
      "supports": "R_3 > 180 (lower bound)",
      "artifact": "artifacts/claims/rado/rado-r3-a2-b5/witness.txt",
      "artifact_sha256": "3ba8e8ddbe5ba243c904d131153d34d687fbb8c36d0b3e4efc32aa459310c31e",
      "check_status": "checked",
      "checker_command": "python3 scripts/check-claim-certificates.py",
      "artifact_format": "colouring-text"
    },
    {
      "id": "upper-drat",
      "kind": "unsat-certificate",
      "supports": "R_3 <= 181 (upper bound)",
      "artifact": "artifacts/claims/rado/rado-r3-a2-b5/F_181.drat.gz",
      "artifact_sha256": "6fab273188a8b7d7cdd9fd73d378cdc8c3e343bd2adb558bd73dd5761f94f09a",
      "check_status": "checked",
      "checker_command": "cargo run --release -p axeyum-search --example recertify_rado -- 2 5 3 181 artifacts/claims/rado/rado-r3-a2-b5/F_181.cnf /tmp/rado-r3-a2-b5.drat 1.0   # regenerates the CNF (byte-compared against the stored one), re-solves with axeyum's proof-producing core, and re-derives the proof with axeyum's backward DRAT checker; the stored artifact is the gzip of exactly such a run",
      "artifact_format": "drat-text-gzip",
      "notes": "RE-CERTIFIED 2026-08-12 inside axeyum's own stack: the proof was produced by the in-tree proof-producing CDCL core streaming TEXT DRAT to disk (0.006 s, 980 steps), read back through axeyum's own parse_drat, and re-derived by axeyum's own backward DRAT checker (0.007 s). No external solver and no external checker took part. SUPERSEDES the original kissat certificate (sha256 cbd756e6bca75fc9d2e8544142542fedb85299fab742c3c8ce94f54ac020beef, 35918 bytes), which was BINARY DRAT: drat-trim verified it, but axeyum's own parse_drat reads text DRAT, so the shipped system could not read the certificate it shipped (findings register B8). The deciding CNF beside it regenerates byte-identically from the claim's parameters.",
      "parameters": {
        "producer": "axeyum solve_with_drat_proof_streaming + TextProofSink (crates/axeyum-cnf, ADR-0381)",
        "checker": "axeyum check_drat_backward (crates/axeyum-cnf, ADR-0382)",
        "proof_steps": 980,
        "proof_bytes": 27743,
        "proof_sha256": "1f5a78c5aebd3bfac4d2870ecd09a5e2cc6e17cbaa84075c85fd4070ec98e087",
        "solve_seconds": 0.006,
        "check_seconds": 0.007
      }
    }
  ],
  "notes": "Replication of a published value with independent artifacts: the witness is replay-verified by a third enumerator implementation, and the UNSAT side carries a drat-trim-verified certificate for the exact generated instance."
}
